{"$schema":"https://json-schema.org/draft/2020-12/schema","$id":"https://insurancereviewlab.com/schemas/wordpress-draft-delivery.schema.json","title":"IRL WordPress Draft Delivery","type":"object","additionalProperties":false,"required":["delivery_id","adapter_id","publisher_id","publication_id","draft_id","platform","api_version","endpoint","method","request_payload","execution_mode","lifecycle_stage","delivery_status","evidence_refs","audit"],"properties":{"delivery_id":{"type":"string","minLength":1},"adapter_id":{"type":"string","minLength":1},"publisher_id":{"type":"string","minLength":1},"publication_id":{"type":"string","minLength":1},"draft_id":{"type":"string","minLength":1},"platform":{"const":"wordpress"},"api_version":{"const":"v2"},"endpoint":{"const":"/wp-json/wp/v2/posts"},"method":{"const":"POST"},"request_payload":{"type":"object","additionalProperties":false,"required":["title","content","status"],"properties":{"title":{"type":"string","minLength":1},"content":{"type":"string","minLength":1},"status":{"const":"draft"},"slug":{"type":"string"},"excerpt":{"type":"string"}}},"execution_mode":{"enum":["dry_run","live"]},"lifecycle_stage":{"const":"wordpress_draft_ready"},"delivery_status":{"const":"ready"},"evidence_refs":{"type":"array","minItems":1,"uniqueItems":true,"items":{"type":"string","minLength":1}},"audit":{"type":"object","additionalProperties":false,"required":["method","version","validation_status"],"properties":{"method":{"type":"string","minLength":1},"version":{"type":"string","minLength":1},"validation_status":{"const":"validated"}}}}}