{
    "delivery_id": "wp_draft_6c15d5cdbc4da07f",
    "adapter_id": "wp_adapter_6ec7c39107ca4983",
    "publisher_id": "publisher_458874d94d2731e7",
    "publication_id": "pub_9ea8b2205a4cb77a",
    "draft_id": "draft_c47a58f38ce3f445",
    "execution_mode": "dry_run",
    "request_payload": {
        "title": "A Practical Guide to Consultant Professional Liability Insurance",
        "content": "<h2>Introduction</h2>\nThe Hartford's consultant guidance frames professional liability insurance as coverage relevant to consultants who provide services directly to customers and face claims involving errors, omissions, negligence, misrepresentation, or inaccurate advice.\n<h2>What You Need to Know</h2>\nThe Hartford explains that professional liability insurance can help protect a business when a client claims that a mistake in professional services caused a financial loss. It identifies negligence, misrepresentation, and inaccurate advice as examples of claims.\n\nHiscox describes professional liability insurance, also called errors and omissions insurance, as protection for businesses sued over negligent performance of professional services and recommends it for businesses that provide professional services or regularly give advice to clients.\n\nThe Hartford says consultants who provide services directly to customers should consider professional liability insurance and describes common consultant claims involving errors, omissions, negligence, misrepresentation, and inaccurate advice.\n<h2>Coverage and Key Factors</h2>\nHiscox describes professional liability insurance for business consultants as protection against claims of negligence and judgment errors arising from professional services\n\nCornell's risk guidance says professional liability coverage for consultants can address claims involving negligence, personal injury such as libel and slander, work completed in the past, and employees or independent contractors\n<h2>Costs and Pricing Factors</h2>\nInsureon reports that consultants pay an average of $62 per month for professional liability insurance, with annual policy costs ranging from around $400 to over $3,750. It says the figures are based on the median cost of policies purchased by consulting businesses through Insureon.\n\nThe Hartford says professional liability insurance costs for consultants vary by business and lists claims history, type of business, coverage limits, and experience as factors that can affect the cost.\n\nInsureon says the cost of professional liability insurance depends on factors including the services offered, revenue, coverage limits, and other business risks.\n<h2>How to Compare Options</h2>\nInsureon says consultants comparing professional liability policies should review the coverage limits, deductible, and exclusions because policies can provide different types and amounts of coverage.\n\nThe Hartford explains that many professional liability policies are claims-made and that a retroactive date and extended reporting period affect when claims can be covered; it recommends understanding these terms when evaluating a policy.\n\nInsureon says professional liability policies can differ in the types and amounts of coverage they provide and advises reviewing policy language for claims-made versus occurrence coverage, coverage limits, deductibles, and exclusions.\n<h2>Frequently Asked Questions</h2>\nHow does professional liability insurance work?: The Hartford explains that professional liability insurance, also called E&O insurance, can protect a business when a client claims that a mistake in professional services caused financial loss; it also explains that many professional liability policies are claims-made and that occurrence policies can cover losses that happen during the policy period even if reported after expiration.\n\nWhat does professional liability insurance cover?: The Hartford says professional liability insurance can help cover errors and omissions, personal injury, misrepresentation, negligence, and inaccurate advice, and can also help pay legal defense costs, disciplinary proceedings, loss of earnings, damages, and subpoena assistance.\n\nWho needs professional liability insurance?: The Hartford says businesses that provide services directly to customers or regularly give advice to clients should consider professional liability insurance, and consultants are specifically included in its industry guidance.\n\nDo consultants need professional liability insurance?: Insureon says businesses that offer professional services or give advice to clients need professional liability insurance, and specifically identifies consultants among businesses that should secure coverage against negligence, errors, or failure to perform services.\n<h2>Sources and Editorial Methodology</h2>\nThis article draft uses section-scoped evidence contracts: page-reviewed sources support editorial sections, claims retain explicit evidence_refs, and evidence provenance records the verification method used for each source.",
        "status": "draft"
    },
    "platform": "wordpress",
    "api_version": "v2",
    "endpoint": "/wp-json/wp/v2/posts",
    "method": "POST",
    "lifecycle_stage": "wordpress_draft_ready",
    "delivery_status": "ready",
    "evidence_refs": [
        "ev_9a2aedbda182447f",
        "ev_serp_result_e444932ffdbdcf4c",
        "ev_serp_result_ff1b4f79644246be",
        "ev_serp_result_a313311899a979c3",
        "ev_serp_result_c1d68f3c48a13f97",
        "ev_serp_result_cba8fb55be152463",
        "ev_serp_distribution_5bd5f8181a2685d0",
        "ev_serp_dominant_5bd5f8181a2685d0",
        "ev_serp_mixed_5bd5f8181a2685d0",
        "ev_intent_alignment_b80d94868d8444df",
        "ev_serp_strategy_ad409d2a44c3792b",
        "ev_b68e2e74a3d8d68d7f0b6f28",
        "ev_d0ee01a51f13063e7d47c3d3",
        "ev_f27f204e172f0bc28f509ce8",
        "ev_ad6b4817da573d3539e55967",
        "ev_7be8f8d28256603c97e78523",
        "ev_9e4fd2bf505c53588b7dca01",
        "ev_75c4849a49f1e0ec17c3ca9d",
        "ev_3c101e172deffec73fc173d2",
        "ev_e08d48a1e6c8769e7f384c56",
        "ev_11d67e0727eee22468ec7721",
        "ev_c4d36efbb9712e7962801f0a",
        "ev_4facf32aac256200c3945fd1",
        "ev_aacb3b16843de77896baf355",
        "ev_c6ca61471538bfcf327d46a6",
        "ev_99663307d0614f16c33e393b",
        "ev_e4c24c3305be8fd806939e56",
        "ev_b157e1257743122ff7d6c68b",
        "ev_db081695cfad6d9d69e187b8",
        "ev_259d00013793f1213fcd7cd7",
        "editorial_page_hartford_intro_20260825",
        "editorial_page_hartford_faq_20260825",
        "editorial_page_hiscox_basics_20260825",
        "editorial_page_hartford_consultants_20260825",
        "editorial_page_hiscox_20260824",
        "editorial_page_hartford_20260824",
        "editorial_page_cornell_20260824",
        "editorial_page_insureon_consulting_cost_20260825",
        "editorial_page_hartford_consultant_cost_20260825",
        "editorial_page_insureon_pli_cost_20260825",
        "editorial_page_insureon_compare_20260825",
        "editorial_page_hartford_claims_made_20260825",
        "editorial_page_insureon_pli_claim_20260825",
        "editorial_article_methodology_20260825",
        "editorial_page_hartford_faq_workflow_20260825",
        "editorial_page_hartford_faq_coverage_20260825",
        "editorial_page_hartford_faq_need_20260825",
        "editorial_page_insureon_faq_consultants_20260825"
    ],
    "audit": {
        "method": "wordpress_draft_delivery",
        "version": "v1",
        "validation_status": "validated"
    }
}