{
    "delivery_id": "wp_draft_50cf6fd2117f939f",
    "adapter_id": "wp_adapter_92f7fead92ea050d",
    "publisher_id": "publisher_acda329bf60ace6c",
    "publication_id": "pub_f9134aca181e0fac",
    "draft_id": "draft_3684bbf5c7ab5a41",
    "execution_mode": "dry_run",
    "request_payload": {
        "title": "A Practical Guide to Expat Health Insurance",
        "content": "<h2>Introduction</h2>\nThis guide focuses on expat health insurance and its topic fit evidence for expat health insurance, where the finding is recorded as 0.9667.\n<h2>What You Need to Know</h2>\nThe research evidence records score for www.international-sante.com: has a recorded value of 0.3455. The research evidence records score for www.imglobal.com: has a recorded value of 0.95. The research evidence records type for www.international-sante.com: has a recorded value of organization. The research evidence records mentioned for aaro.org: is supported.\n<h2>Coverage and Key Factors</h2>\nThe research evidence records score for www.international-sante.com: has a recorded value of 0.3455. The research evidence records score for www.imglobal.com: has a recorded value of 0.95. The research evidence records type for www.international-sante.com: has a recorded value of organization. The research evidence records mentioned for aaro.org: is supported.\n<h2>Costs and Pricing Factors</h2>\nThe research evidence records affiliate potential for expat health insurance: has a recorded value of low. The research evidence records commercial value for expat health insurance: has a recorded value of low. The research evidence records conversion potential for expat health insurance: has a recorded value of low. The research evidence records adsense potential for expat health insurance: has a recorded value of low.\n<h2>How to Compare Options</h2>\nThe research evidence records score for www.international-sante.com: has a recorded value of 0.3455. The research evidence records score for www.imglobal.com: has a recorded value of 0.95. The research evidence records score for www.allianzcare.com: has a recorded value of 0.7667. The research evidence records score for www.internationalinsurance.com: has a recorded value of 0.45.\n<h2>Frequently Asked Questions</h2>\nThe research evidence records primary intent for expat health insurance: has a recorded value of Informational. The research evidence records count for expat health insurance: has a recorded value of 8. The research evidence records alignment for expat health insurance: has a recorded value of mixed. The research evidence records intent distribution for expat health insurance: has a recorded value of {'Commercial': 0.2747, 'Informational': 0.6337, 'Transactional': 0.0916}.\n<h2>Sources and Editorial Methodology</h2>\nThe research evidence records authority score for expat health insurance: has a recorded value of 0.9278. The research evidence records topic fit for expat health insurance: has a recorded value of 0.9667. The research evidence records score for www.international-sante.com: has a recorded value of 0.3455. The research evidence records score for www.imglobal.com: has a recorded value of 0.95.",
        "status": "draft"
    },
    "platform": "wordpress",
    "api_version": "v2",
    "endpoint": "/wp-json/wp/v2/posts",
    "method": "POST",
    "lifecycle_stage": "wordpress_draft_ready",
    "delivery_status": "ready",
    "evidence_refs": [
        "ev_454e683da39cd64e",
        "ev_serp_result_8c55baaa568b274e",
        "ev_serp_result_9fca0aafc956a04f",
        "ev_serp_result_27c34d1b9fd94a85",
        "ev_serp_result_934b1f0f571fbebc",
        "ev_serp_result_45fad6e64d09c0fa",
        "ev_serp_result_ec809fb47b6a343c",
        "ev_serp_result_4413a1140f635b3d",
        "ev_serp_result_1872aaa543564c6b",
        "ev_serp_result_892a0c39ffc23f0e",
        "ev_serp_distribution_23165a6f509de19b",
        "ev_serp_dominant_23165a6f509de19b",
        "ev_serp_mixed_23165a6f509de19b",
        "ev_intent_alignment_91b405f6a64df87f",
        "ev_serp_strategy_233923c86c15a3ff",
        "ev_1f7c321cdd7bbdefe1b7855f",
        "ev_66f8572090e5cf1c0bb2a707",
        "ev_13ef75e026eb0bd9b79113c1",
        "ev_50e9829c101f7598b6abbed2",
        "ev_e46114e2a051b4e33b77ea50",
        "ev_28b89e80c06138321f65204e",
        "ev_4912cc056c11898cfd31b559",
        "ev_41ce894922a669e77259fe8d",
        "ev_a4f6407a46d260fa22115039",
        "ev_bc9ff3dcb9f285126eaa9056",
        "ev_9b0ec503dd8840276bbd1920",
        "ev_e0a5ce381840068fecf3b3df",
        "ev_966b60767ec46c4b67169fe5",
        "ev_c8691b781dd1015730fd7ed9",
        "ev_95b314fd4ffaf1a9d24ca9f3",
        "ev_d5eaa5677934b1b915cd1bdc",
        "ev_3208ff0460e2eac3dbfb4281",
        "ev_63d7e6223b14df00ac60858a",
        "ev_1c9e5d9ea6c70ffa5f47e7b9",
        "ev_8339719bc6939f1323a34b60",
        "ev_ed51b02715143f81635f7151",
        "ev_f6c60ce0bfdde4c3d62c2f96",
        "ev_8524552715be757833bbad8b",
        "ev_4f502e2cf646837ad3f36c8d",
        "ev_34d5b8c82a8a2b98aee648dc",
        "ev_1bf31d73d0b60edf2c380eb9",
        "ev_07fc4e7394d17a0f39bcc541",
        "ev_f84050d29bd3788b8db432d4",
        "ev_b633ce73305b1d2c88449135",
        "ev_d0907041f5ed42b9daf437e3",
        "ev_7b92ea8033047a27cfc7dd90",
        "ev_45682e20adad3758e08109db",
        "ev_7728da4194f34bd5e6a1cf77",
        "ev_a55b2cd0b14d31d8f94c3634"
    ],
    "audit": {
        "method": "wordpress_draft_delivery",
        "version": "v1",
        "validation_status": "validated"
    }
}